anchor_best_valid_mrr20,anchor_setting_key,anchor_test_mrr20,axis_label,best_run_phase,best_setting_key,best_test_mrr20,best_valid_mrr20,claim_bucket,delta_best_test_vs_anchor,delta_best_valid_vs_anchor,diag_missing_count,evidence_source,expectation_type,expected_pattern,match_flag,mean_cold_main,mean_diag_cv_main,mean_diag_n_eff_main,mean_diag_top1_main,mean_long_session_main,mean_test_main,mean_valid_main,n_rows_dedup,n_rows_main,observed_tag,paper_claim_template,phase_title,plan_intent,setting_group,source_phase,special_missing_count
0.081025,C0-mean,0.1603625,Natural,P9_B4_C0_N4_S1,B4_C0_N4,0.1591,0.0827,,-0.0012624999999999997,0.001674999999999996,0,phase8_9/phase9_main.csv,tradeoff_or_stability,"보수적 개선 또는 유지, 큰 붕괴 없이 자연 분포",1,0.11670604257128663,0.7245359803086024,8.671018300849703,0.41747405289428524,,0.1603625,0.081025,16,16,observed_phase9_concept,약한 정규화만으로도 안정적인 성능대를 유지할 수 있다.,Aux Loss Concept Study,aux 최소/약한 안정화로 baseline 대비 변화 확인,C0_Natural,P9,0
0.08109375,C1-mean,0.16040625,CanonicalBalance,P9_B3_C1_B1_S1,B3_C1_B1,0.1595,0.0826,,-0.0009062499999999973,0.0015062500000000006,0,phase8_9/phase9_main.csv,tradeoff_or_stability,"valid 안정성 개선 가능, 강도 과다 시 test 손실 위험",1,0.11592077031523443,0.5990310698417589,9.039262056808399,0.37432405524345197,,0.16040625,0.08109375,16,16,observed_phase9_concept,균형 유도는 성능/안정성 trade-off를 조절하는 핵심 축이다.,Aux Loss Concept Study,expert/group usage 균형 유도로 안정성 향상 검증,C1_CanonicalBalance,P9,0
0.08065,C2-mean,0.16104374999999999,Specialization,P9_B1_C2_S3_S1,B1_C2_S3,0.1596,0.0818,,-0.0014437499999999936,0.0011499999999999982,0,phase8_9/phase9_main.csv,target_near_or_better,"특정 base에서 고점, 과도 특화는 일반화 하락 가능",1,0.11872888692740502,0.908402904057825,8.45844895063159,0.44118427646783764,,0.16104374999999999,0.08065,16,16,observed_phase9_concept,적절한 특화는 유효하지만 과도 집중은 일반화 리스크를 만든다.,Aux Loss Concept Study,route 집중(특화)과 일반화 손실 간 균형 확인,C2_Specialization,P9,0
0.08091333333333334,C3-mean,0.16040000000000001,FeatureAlignment,P9_B2_C3_F2_S1,B2_C3_F2,0.1593,0.082,,-0.0011000000000000176,0.0010866666666666663,0,phase8_9/phase9_main.csv,target_near_or_better,feature-rich 조건에서 상대 이득 가능,1,0.1166267148913193,0.6545982441250043,8.747656117344423,0.4373806865682105,,0.16040000000000001,0.08091333333333334,15,15,observed_phase9_concept,feature-aligned routing은 성능 분포를 유의미하게 이동시킨다.,Aux Loss Concept Study,feature prior와 routing 정렬 효과 검증,C3_FeatureAlignment,P9,0
0.0813,P10-00_FULL,0.1618,Availability ablation,P10_18_NO_CATEGORY_S1,P10-18_NO_CATEGORY,0.1582,0.082,P10:availability,-0.003599999999999992,0.0007000000000000062,0,phase10_13/intent_vs_observed_summary.csv,tradeoff_or_stability,"Moderate degradation, not catastrophic collapse.",1,0.11690075911543668,0.6657276978147839,6.2250810031481985,0.5017518071803959,0.16955773966190368,0.1598,0.08145,2,2,matched_tradeoff,The framework remains functional even under partial feature availability constraints.,Feature Portability / Compactness,Drop category/timestamp families structurally to test portability under missing common metadata.,availability,P10,0
0.0813,P10-00_FULL,0.1618,Availability plus,,,,,P10:availability_plus,,,0,phase10_13/intent_vs_observed_summary.csv,control_expected_drop,Noticeable degradation; useful as stress-control evidence.,0,,,,,,,,0,0,no_anchor,Severe multi-signal removal reveals the boundary of portability.,Feature Portability / Compactness,Stress missing-signal conditions with combined category+timestamp removals.,availability_plus,P10,0
0.0813,P10-00_FULL,0.1618,Intra-group compactness,P10_15_TOP2_PER_GROUP_S1,P10-15_TOP2_PER_GROUP,0.1608,0.0812,P10:compactness,-0.0010000000000000009,-0.00010000000000000286,0,phase10_13/intent_vs_observed_summary.csv,tradeoff_or_stability,Small-to-moderate drop from anchor while retaining strong test behavior.,1,0.1163004362879093,0.9553748801231827,7.224518472301786,0.6380083242536175,0.17043031619728632,0.16063333333333332,0.08093333333333333,3,3,matched_tradeoff,Few representative signals per family are sufficient for robust feature-aware routing.,Feature Portability / Compactness,Reduce feature count within each family (TOP2/TOP1/common template) to test reusable compact templates.,compactness,P10,0
0.0813,P10-00_FULL,0.1618,Compactness plus,,,,,P10:compactness_plus,,,0,phase10_13/intent_vs_observed_summary.csv,tradeoff_or_stability,Moderate drop but non-trivial residual performance.,0,,,,,,,,0,0,no_anchor,Even stricter compactness-plus settings preserve a meaningful portion of gains.,Feature Portability / Compactness,Combine compact template with category removal for stricter portability checks.,compactness_plus,P10,0
0.0813,P10-00_FULL,0.1618,Family subset lattice,P10_14_FOCUS_MEMORY_EXPOSURE_S1,P10-14_Focus_Memory_Exposure,0.1587,0.0824,P10:group_subset,-0.0030999999999999917,0.0011000000000000038,0,phase10_13/intent_vs_observed_summary.csv,target_near_or_better,Competitive or near-anchor valid/test with interpretable family sensitivity.,1,0.11775407224143826,0.3668958248186467,5.3624516619278095,0.4615031236459664,0.170297193202273,0.16074666666666668,0.0803,15,15,matched_gain,"A compact subset of feature families can preserve most of the gain, indicating portability beyond large handcrafted banks.",Feature Portability / Compactness,Identify which feature families are necessary and whether 2~3-family subsets stay near full setting.,group_subset,P10,0
0.0813,P10-00_FULL,0.1618,Stochastic usage,P10_21_FEATURE_DROPOUT_S1,P10-21_FEATURE_DROPOUT,0.1621,0.0811,P10:stochastic,0.0002999999999999947,-0.00019999999999999185,0,phase10_13/intent_vs_observed_summary.csv,target_near_or_better,Comparable or slightly better test generalization with stable router diagnostics.,1,0.12196968428017396,0.10078024183571536,11.876559426628233,0.21415339387471558,0.17115822196108862,0.16215000000000002,0.081,2,2,near_anchor,Stochastic feature usage improves robustness without requiring larger feature banks.,Feature Portability / Compactness,Apply feature/family dropout during training to probe robustness to feature availability variation.,stochastic,P10,0
0.0829,P11-00_MACRO_MID_MICRO,0.1573,Base stage ablation,P11_A00_H1_S1,P11-00_MACRO_MID_MICRO,0.1573,0.0829,P11:base_ablation,0.0,0.0,0,phase10_13/intent_vs_observed_summary.csv,target_near_or_better,Full 3-stage or select 2-stage settings should lead; single-stage likely weaker.,1,0.11847751486838705,0.6128139012884839,9.284461884917741,0.4041631069599577,0.17034938252247644,0.16074285714285713,0.08009999999999999,7,7,matched_gain,"Performance depends on temporal-horizon decomposition, not just MoE presence.",Stage Semantics / Necessity / Granularity,Test whether macro/mid/micro decomposition is meaningful versus reduced stage sets.,base_ablation,P11,0
0.0829,P11-00_MACRO_MID_MICRO,0.1573,Depth controls,P11_A23_H1_S1,P11-23_LAYER2_MACRO_MID_MICRO,0.1619,0.0815,P11:extra_alignment,0.004599999999999993,-0.0013999999999999985,1,phase10_13/intent_vs_observed_summary.csv,control_expected_drop,Control settings should not dominate best stage-semantic variants.,1,0.1167764430849425,0.14505330220182552,11.752717653998058,0.24750373070047677,0.17013011470267025,0.1607,0.0799,2,2,matched_control_drop,Improvements are not explained by generic depth increases alone.,Stage Semantics / Necessity / Granularity,Use layer-only controls to reject purely depth-driven explanations.,extra_alignment,P11,0
0.0829,P11-00_MACRO_MID_MICRO,0.1573,Stage order permutation,P11_A17_H1_S1,P11-17_MICRO_MACRO_MID,0.1593,0.0832,P11:order_permutation,0.0020000000000000018,0.0002999999999999947,0,phase10_13/intent_vs_observed_summary.csv,target_near_or_better,Order differences are visible; a few permutations may compete strongly.,1,0.11863536924880717,0.5033318591670299,9.593222136128167,0.396980537713075,0.170864278318185,0.1612,0.08212,5,5,matched_gain,"Ordering influences routing behavior, supporting stage-semantic interpretation.",Stage Semantics / Necessity / Granularity,Measure sensitivity to stage order to validate coarse-to-fine rationale.,order_permutation,P11,0
0.0829,P11-00_MACRO_MID_MICRO,0.1573,Prepend dense layer,P11_A07_H1_S1,P11-07_LAYER_MACRO_MID_MICRO,0.1618,0.0811,P11:prepend_layer,0.004500000000000004,-0.001799999999999996,0,phase10_13/intent_vs_observed_summary.csv,tradeoff_or_stability,No consistent domination over base-stage variants.,1,0.11983100331480909,0.3477351235544737,10.481382615493198,0.328852977001498,0.17044770881838173,0.16117142857142855,0.08009999999999999,7,7,partial_tradeoff,Stage decomposition contributes beyond simply adding dense contextualization depth.,Stage Semantics / Necessity / Granularity,Check if gains are just from extra dense depth before stage routing.,prepend_layer,P11,0
0.0829,P11-00_MACRO_MID_MICRO,0.1573,Routing granularity,P11_A20_H1_S1,P11-20_SESSION_TOKEN_TOKEN,0.1603,0.0819,P11:routing_granularity,0.0030000000000000027,-0.0010000000000000009,0,phase10_13/intent_vs_observed_summary.csv,tradeoff_or_stability,Session-aware variants should remain competitive and interpretable.,1,0.12048021106794655,0.29280359902275827,10.737090381779998,0.20705107983363424,0.17060943548177346,0.16113333333333332,0.0815,3,3,matched_tradeoff,Macro/mid routing behaves naturally as session-regime routing.,Stage Semantics / Necessity / Granularity,Compare session-level and token-level routing for macro/mid stages.,routing_granularity,P11,0
0.0802,P12-00_ATTN_ONESHOT,0.1615,All-stage bundle,P12_A21_H1_S1,P12-21_BUNDLE_ALL_LEARNED,0.1593,0.0773,P12:bundle_all,-0.0022000000000000075,-0.0029,0,phase10_13/intent_vs_observed_summary.csv,control_expected_drop,Likely weaker than top serial/layout variants; acts as negative control.,1,0.12291909301978814,0.2661775244673419,11.173892659155479,0.1968385436359582,0.16908430666021826,0.15913333333333335,0.07703333333333333,3,3,matched_control_drop,Serial horizon separation is often preferable to collapsing all horizons at once.,Layout Composition / Attention Placement,Use all horizons simultaneously as aggressive alternative to serial decomposition.,bundle_all,P12,0
0.0802,P12-00_ATTN_ONESHOT,0.1615,Bundle chain,P12_A29_H1_S1,P12-29_BUNDLE_MACROMICRO_THEN_MIDMICRO_SUM,0.1579,0.0782,P12:bundle_chain,-0.003599999999999992,-0.001999999999999988,0,phase10_13/intent_vs_observed_summary.csv,control_expected_drop,Generally lower stability than top layout variants.,1,0.12092608391119408,0.4041922265445136,10.278920631744198,0.20389676419064495,0.1693574827699736,0.1590625,0.0776375,8,8,matched_control_drop,More complex bundle chains do not automatically improve routing quality.,Layout Composition / Attention Placement,Chain multiple bundles to test deeper interaction composition.,bundle_chain,P12,0
0.0802,P12-00_ATTN_ONESHOT,0.1615,Pair bundle then follow,P12_A18_H1_S1,P12-18_BUNDLE_MACROMICRO_LEARNED,0.1616,0.0808,P12:bundle_pair_then_follow,9.999999999998899e-05,0.0006000000000000033,0,phase10_13/intent_vs_observed_summary.csv,tradeoff_or_stability,"Some competitive cases, but mixed stability.",1,0.12236057621560698,0.3092105586951902,10.791892691831807,0.22300279190385172,0.17086928934034062,0.16134444444444443,0.08031111111111111,9,9,matched_tradeoff,"Selected horizon interaction can help, but not all bundling is beneficial.",Layout Composition / Attention Placement,Test selected horizon interactions via 2-stage bundles before follow-up stage.,bundle_pair_then_follow,P12,0
0.0802,P12-00_ATTN_ONESHOT,0.1615,Router-conditioned bundle,P12_A24_H1_S1,P12-24_BUNDLE_MACROMID_ROUTER_CONDITIONED,0.1611,0.0805,P12:bundle_router,-0.00040000000000001146,0.0003000000000000086,0,phase10_13/intent_vs_observed_summary.csv,tradeoff_or_stability,Can recover part of bundle gap with better adaptivity.,1,0.12013898859711578,0.40215308194774874,9.95485958335572,0.25229267485071605,0.16959709608280693,0.15955,0.0786,2,2,matched_tradeoff,"Adaptive aggregation helps, but composition bias remains a critical factor.",Layout Composition / Attention Placement,Add router-conditioned aggregation for adaptive bundle composition.,bundle_router,P12,0
0.0802,P12-00_ATTN_ONESHOT,0.1615,Layout variants,P12_A07_H1_S1,P12-07_MICRO_REPEATED,0.1619,0.0823,P12:layout_variants,0.0003999999999999837,0.0021000000000000046,0,phase10_13/intent_vs_observed_summary.csv,target_near_or_better,Several layout variants should be strong and stable.,1,0.12125230160697278,0.2457588145245087,11.023998900061803,0.30292325831660954,0.170927384595752,0.16145,0.08066,10,10,matched_gain,Composition details matter: identical stage sets can differ by layout quality.,Layout Composition / Attention Placement,Change attention placement and local refinement while keeping stage set.,layout_variants,P12,0
0.0812,P13-00_FULL_DATA,0.1615,Data condition,P13_A01_H1_S1,P13-01_CATEGORY_ZERO_DATA,0.1624,0.0812,P13:data_condition,0.0008999999999999841,0.0,0,phase10_13/intent_vs_observed_summary.csv,tradeoff_or_stability,Moderate drop relative to clean full-data anchor.,1,0.12217651913712999,0.13267778396076607,11.79200046975222,0.22071204361843266,0.17113495441231755,0.16194999999999998,0.0812,2,2,matched_tradeoff,"Category signals help, but the framework can remain functional under weakened category cues.",Feature Sanity / Corruption Checks,Simulate category-zero data conditions without structural feature removal.,data_condition,P13,0
0.0812,P13-00_FULL_DATA,0.1615,Eval perturbation,P13_A05_H1_S1,P13-05_EVAL_SHUFFLE_FOCUS,0.1616,0.0807,P13:eval_perturb,9.999999999998899e-05,-0.0005000000000000004,0,phase10_13/intent_vs_observed_summary.csv,control_expected_drop,Clear drop under all-zero/all-shuffle controls.,1,0.11455841585678368,0.17753232161511442,11.558608124750833,0.3505650305279808,0.16965727141815082,0.15965,0.0792,6,6,weak_control_drop,"Inference-time perturbation degrades performance, indicating active feature usage.",Feature Sanity / Corruption Checks,Perturb features only at evaluation to test direct feature usage at inference.,eval_perturb,P13,0
0.0812,P13-00_FULL_DATA,0.1615,Eval perturb extra,P13_A17_H1_S1,P13-17_EVAL_ZERO_TEMPO,0.1595,0.0807,P13:eval_perturb_extra,-0.0020000000000000018,-0.0005000000000000004,0,phase10_13/intent_vs_observed_summary.csv,control_expected_drop,Should behave as negative controls with visible degradation.,1,0.11882982740330095,0.8492189743545482,7.675166409390054,0.5713867019265404,0.17017239629016162,0.1603,0.07944999999999999,4,4,weak_control_drop,Additional perturb controls reinforce that routing depends on aligned feature signals.,Feature Sanity / Corruption Checks,Supplement perturbation controls with stronger family-focused stress variants.,eval_perturb_extra,P13,0
0.0812,P13-00_FULL_DATA,0.1615,Semantic mismatch,P13_A15_H1_S1,P13-15_STAGE_MISMATCH_ASSIGN,0.1617,0.081,P13:semantic_mismatch,0.00020000000000000573,-0.00019999999999999185,0,phase10_13/intent_vs_observed_summary.csv,control_expected_drop,Meaningful drop or instability under semantic mismatch.,1,0.12111151487727384,0.4040178655724257,10.212324914913257,0.3214901771271705,0.1706626990501957,0.1617,0.0809,2,2,weak_control_drop,Semantic and temporal alignment of features is crucial for routing quality.,Feature Sanity / Corruption Checks,Introduce role/stage/position mismatch for stronger sanity checks beyond zero/shuffle.,semantic_mismatch,P13,0
0.0812,P13-00_FULL_DATA,0.1615,Train corruption,P13_A10_H1_S1,P13-10_TRAIN_PERMUTE_TEMPO,0.162,0.0811,P13:train_corruption,0.0005000000000000004,-9.999999999998899e-05,0,phase10_13/intent_vs_observed_summary.csv,control_expected_drop,Corrupted training should underperform clean alignment.,1,0.12127314804805814,0.1207173498679333,11.818071406548622,0.3471267453749382,0.17067137330912907,0.16158,0.08056,5,5,weak_control_drop,"Aligned feature guidance, not branch size alone, explains gains.",Feature Sanity / Corruption Checks,Break feature-sequence alignment during training to separate parameter count from aligned signal learning.,train_corruption,P13,0
0.0812,P13-00_FULL_DATA,0.1615,Train shift extra,P13_A22_H1_S1,P13-22_TRAIN_POSITION_SHIFT_PLUS2,0.1614,0.0809,P13:train_shift_extra,-0.00010000000000001674,-0.0002999999999999947,0,phase10_13/intent_vs_observed_summary.csv,control_expected_drop,Shift stress should reduce performance versus clean anchor.,1,0.10689457334689778,0.2807482087399117,11.11300886866681,0.19480259914788636,0.1685399384099832,0.15826666666666667,0.0801,3,3,weak_control_drop,Temporal misalignment during training directly weakens downstream ranking quality.,Feature Sanity / Corruption Checks,Shift-based corruption for graded alignment stress at train time.,train_shift_extra,P13,0
